question,actual results,our results
Who is the mayor of the capital of French Polynesia?,capital,capital/part/birthPlace
Which river does the Brooklyn Bridge cross?,crosses,writer/crosses/associatedBand
Which books by Kerouac were published by Viking Press?,publisher/author,publisher/based/developer
How many inhabitants does the largest city in Canada have?,largestCity,city/largestCity/country
Who created Family Guy?,creator,creator/associatedBand/associatedMusicalArtist
Who created Wikipedia?,author,creator/associatedBand/associatedMusicalArtist
Who is the president of Eritrea?,leader,residence/birthPlace/almaMater
In which country does the Nile start?,sourceCountry,associatedBand/associatedMusicalArtist/influencedBy
To which party does the mayor of Paris belong?,party,party/birthPlace/residence
How often did Jane Fonda marry?,spouse,parent/associatedBand/associatedMusicalArtist
Does Abraham Lincoln's death place have a website?,deathPlace,relation/associatedBand/associatedMusicalArtist
Who is the coach of Ankara's ice hockey team?,city/league/coach,coach/team/managerClub
Give me all cities in New Jersey with more than 100000 inhabitants.,isPartOf,city/country/state
When did Dracula's creator die?,creator,creator/child/associatedMusicalArtist
Did Arnold Schwarzenegger attend a university?,almaMater,university/almaMater/team
Who was married to president Chirac?,spouse,parent/spouse/child
In which countries do people speak Japanese?,language,spouse/associatedBand/associatedMusicalArtist
Which awards did Douglas Hofstadter win?,award,award/team/formerTeam
Who is starring in Spanish movies produced by Benicio del Toro?,country/producer/starring,starring/producer/writer
Is Rita Wilson the wife of Tom Hanks?,spouse,relation/writer/spouse
Who is the son of Sonny and Cher?,parent/parent,spouse/predecessor/relation
Who composed the music for Harold and Maude?,musicComposer,spouse/company/associatedBand
Who wrote the book The Pillars of the Earth?,author,party/writer/associatedBand
Whom did Lance Bass marry?,spouse,parent/spouse/child
Was Natalie Portman born in the United States?,birthPlace/country,country/birthPlace/nationality
Who are the developers of DBpedia?,developer,developer/associatedBand/associatedMusicalArtist
Who discovered Ceres?,discoverer,discoverer/associatedMusicalArtist/associatedBand
Is Christian Bale starring in Velvet Goldmine?,starring,starring/award/birthPlace
Who is the host of the BBC Wildlife Specials?,presenter,team/associatedBand/knownFor
How many seats does the home stadium of FC Porto have?,ground,hometown/location/tenant
In which country does the Ganges start?,sourceCountry,associatedBand/associatedMusicalArtist/influencedBy
Which country does the creator of Miffy come from?,creator/nationality,creator/knownFor/associatedBand
What is the capital of Canada?,capital,capital/country/birthPlace
In which U.S. state is Fort Knox located?,country,state/team/location
What is the highest mountain in Italy?,locatedInArea,country/location/locatedInArea
Where is Syngman Rhee buried?,restingPlace,child/birthPlace/deathPlace
Who created Batman?,creator,creator/associatedBand/associatedMusicalArtist
Who was the pope that founded the Vatican Television?,foundedBy,location/network/channel
In which military conflicts did Lawrence of Arabia participate?,battle,residence/birthPlace/deathPlace
Which subsidiary of TUI Travel serves both Glasgow and Dublin?,subsidiary/targetAirport/targetAirport,subsidiary/parentCompany/owner
How many companies were founded by the founder of Facebook?,foundedBy/foundedBy,founded/associatedBand/associatedMusicalArtist
Where was Bach born?,birthPlace,known/birthPlace/deathPlace
Which museum in New York has the most visitors?,location,team/birthPlace/successor
Who played Gus Fring in Breaking Bad?,portrayer,award/team/formerTeam
Show me all books in Asimov's Foundation series.,series,nationality/series/formerTeam
Which films did Stanley Kubrick direct?,director,team/president/associatedBand
Who designed the Brooklyn Bridge?,architect,designer/instrument/associatedBand
What is the highest mountain in Australia?,locatedInArea,country/location/locatedInArea
What is the location of the Houses of Parliament?,location,location/spouse/tenant
Show me Hemingway's autobiography.,author,author/spouse/team
Who was the wife of U.S. president Lincoln?,spouse,child/spouse/parent
How many children did Benjamin Franklin have?,child,child/associatedBand/associatedMusicalArtist
Who was the successor of John F. Kennedy?,successor,successor/party/birthPlace
Is the wife of president Obama called Michelle?,spouse,influenced/associatedBand/associatedMusicalArtist
Is Michelle Obama the wife of Barack Obama?,spouse,lieutenant/child/spouse
Give me all actors starring in movies directed by William Shatner.,director/starring,starring/director/author
List the children of Margaret Thatcher.,child,child/parent/associatedBand
Is James Bond married?,spouse,associatedBand/spouse/child
Who is the editor of Forbes?,editor,editor/knownFor/employer
Who wrote the Game of Thrones theme?,composer,team/formerTeam/debutTeam
Give me all actors starring in Last Action Hero.,starring,trainer/primeMinister/successor
Who is the daughter of Robert Kennedy married to?,child/spouse,parent/child/spouse
In which country is the Limerick Lake?,country,country/associatedMusicalArtist/associatedBand
Who is the oldest child of Meryl Streep?,child,child/parent/spouse
Who is the youngest player in the Premier League?,team/league,team/formerTeam/league
Give me all video games published by Mean Hamster Software.,publisher,publisher/developer/nationality
In which UK city are the headquarters of the MI6?,headquarter/country,headquarter/city/location
Who were the parents of Queen Victoria?,parent,parent/child/successor
In which films did Julia Roberts as well as Richard Gere play?,starring/starring,successor/associatedBand/president
In which country is Mecca located?,country,location/country/state
Who developed Slack?,product,developer/publisher/influencedBy
Give me all books by William Goldman with more than 300 pages.,author,nationality/associatedBand/associatedMusicalArtist
Which professional surfers were born in Australia?,occupation/birthPlace,parent/birthPlace/known
Who is the mayor of Rotterdam?,leaderName,party/birthPlace/residence
What was the first Queen album?,artist,album/associatedMusicalArtist/associatedBand
What is the largest city in Australia?,largestCity,city/location/country
Give me all launch pads operated by NASA.,operator,operated/party/owner
In which city did John F. Kennedy die?,deathPlace,city/influencedBy/associatedBand
In which city does Sylvester Stallone live?,residence,associatedBand/associatedMusicalArtist/influencedBy
Which subsidiary of Lufthansa serves both Dortmund and Berlin Tegel?,subsidiary/targetAirport/targetAirport,subsidiary/parentCompany/owner
Give me all movies directed by Francis Ford Coppola.,director,director/starring/writer
Which scientist is known for the Manhattan Project and the Nobel Peace Prize?,knownFor/knownFor,known/associatedBand/associatedMusicalArtist
Is Christian Bale starring in Batman Begins?,starring,starring/award/birthPlace
Does the Isar flow into a lake?,inflow,garrison/riverMouth/sourceCountry
Give me all Canadian Grunge record labels.,genre/country,recordLabel/producer/artist
Show me the book that Muhammad Ali wrote.,author,spouse/influencedBy/associatedMusicalArtist
Where in France is sparkling wine produced?,location,starring/associatedMusicalArtist/associatedBand
Who was Vincent van Gogh inspired by?,influenced,influenced/influencedBy/team
What country is Mount Everest in?,locatedInArea,country/associatedBand/associatedMusicalArtist
Was the wife of president Lincoln called Mary?,spouse,child/spouse/parent
Did Elvis Presley have children?,child,child/associatedMusicalArtist/associatedBand
In which city does the Chile Route 68 end?,routeEnd,associatedBand/associatedMusicalArtist/influencedBy
Who developed the video game World of Warcraft?,developer,developer/associatedBand/associatedMusicalArtist
List all games by GMT.,publisher,team/formerTeam/associatedBand
Who composed the soundtrack for Cameron's Titanic?,musicComposer,team/recordLabel/computingPlatform
Which professional surfers were born on the Philippines?,occupation/birthPlace,known/birthPlace/deathPlace
Give me all Swedish oceanographers.,field/birthPlace,partner/influencedBy/doctoralAdvisor
Which country was Bill Gates born in?,birthPlace/country,country/birthPlace/known
Which television shows were created by Walt Disney?,creator,creator/associatedMusicalArtist/associatedBand
How many languages are spoken in Colombia?,language,spouse/birthPlace/nationality
For which label did Elvis record his first album?,artist/recordLabel,associatedBand/associatedMusicalArtist/president
Where does Piccadilly start?,routeStart,party/team/associatedBand
How many languages are spoken in Turkmenistan?,language,spouse/birthPlace/nationality
Who wrote the book Les Piliers de la terre?,author,writer/residence/spouse
To which artistic movement did the painter of The Three Dancers belong?,author,team/partner/influencedBy
Who wrote the song Hotel California?,writer,writer/influencedBy/associatedMusicalArtist
List all episodes of the first season of the HBO television series The Sopranos.,series,team/formerTeam/series
Is Barack Obama a democrat?,party,birthPlace/successor/party
List all episodes of the first season of the HBO television series The Sopranos!,series,team/formerTeam/series
Who is the mayor of Tel Aviv?,leaderName,party/birthPlace/residence
In what city is the Heineken brewery?,manufacturer/locationCity,city/country/associatedMusicalArtist
In which city did Nikos Kazantzakis die?,deathPlace,city/associatedMusicalArtist/associatedBand
Which companies produce hovercrafts?,product,product/associatedBand/associatedMusicalArtist
Did Tesla win a nobel prize in physics?,award,team/birthPlace/college
Which Indian company has the most employees?,location,employer/location/associatedBand
Do Prince Harry and Prince William have the same parents?,parent/parent,parent/child/spouse
Which electronics companies were founded in Beijing?,industry/foundationPlace,country/deathPlace/birthPlace
Who are the parents of the wife of Juan Carlos I?,spouse/parent,child/parent/spouse
Which movies did Kurosawa direct?,director,series/president/associatedBand
How many people live in the capital of Australia?,capital,capital/part/birthPlace
What country is Sitecore from?,foundationPlace,country/associatedBand/associatedMusicalArtist
What was the last movie with Alec Guinness?,starring,formerTeam/associatedBand/associatedMusicalArtist
Was U.S. president Jackson involved in a war?,battle,battle/birthPlace/associatedBand
Does Neymar play for Real Madrid?,team,formerTeam/team/league
In which city was the president of Montenegro born?,birthPlace,residence/birthPlace/almaMater
Which cities does the Weser flow through?,city,city/location/associatedMusicalArtist
List all the musicals with music by Elton John.,musicBy,musicalArtist/music/associatedBand
What is the biggest stadium in Spain?,location,state/location/birthPlace
Did Che Guevara have children?,child,child/associatedMusicalArtist/associatedBand
What is the capital of Cameroon?,capital,capital/country/birthPlace
Which computer scientist won an oscar?,field/award,occupation/team/formerTeam
Who is the king of the Netherlands?,leader,child/predecessor/birthPlace
Who was John F. Kennedy's vice president?,vicePresident,influenced/successor/associatedBand
Who was the doctoral supervisor of Albert Einstein?,doctoralAdvisor,region/almaMater/deathPlace
Which movies starring Mickey Rourke were directed by Guy Ritchie?,starring/director,director/writer/producer
Which of Tim Burton's films had the highest budget?,director,director/writer/starring
Which airports does Yeti Airlines serve?,targetAirport,party/successor/president
In which city are the headquarters of the United Nations?,location,headquarter/country/location
Give me all professional skateboarders from Sweden.,occupation/birthPlace/birthPlace/country,formerTeam/team/country
Give me all members of Prodigy.,bandMember,country/party/associatedMusicalArtist
Give me the grandchildren of Elvis Presley.,child/child,child/spouse/parent
What did Bruce Carver die from?,deathCause,team/type/associatedBand
